<!ELEMENT cd (Discos)*>
<!ELEMENT Discos (titulo|artista|pais|discografica|precio|publicacion)*>
<!ELEMENT titulo (#PCDATA)>
<!ELEMENT artista (#PCDATA)>
<!ELEMENT pais (#PCDATA)>
<!ELEMENT discografica (#PCDATA)>
<!ELEMENT precio (#PCDATA)>
<!ELEMENT publicacion (#PCDATA)>